product_title,pricing
"BECCA Ultimate Coverage 24 Hour Foundation, 1 FL. OZ. NIB",$14.09
"Viva Naturals Organic Cacao Nibs, 2 Lb Bag (907G) - Keto Friendly and Vegan",$25.00
NIB New Cymbiotika SLEEP Liposomal Sleep Cacao 1.7 Fl Oz,$24.50
"Organic Coconut Bites, with Cacao Nibs & Dark Chocolate, 5.25 oz (149 g)",$5.30
8 ounce organic gourmet cacao nibs from Brazil,$9.99
Premium Pure Organic Roasted Cocoa Nibs Cacao Great Best Quality 2 oz up to 10LB,$8.49
BULK 1KG Organic Cacao Nibs / Cocoa Nibs - FREE POST - Premium Quality,$23.62
NEW Nike CORTEZ Women's Casual Shoes ALL COLORS US Sizes 5-11 NIB,$89.99
"Power Super Foods Cacao Crunch (Sweet Cacao Nibs) ""The Origin Series"" 200g",$8.21
Premium Pure Organic Raw Cocoa Nibs Cacao Great Best Quality 2 oz up to 10 LB,$23.59
400 gram Organic Cacao Nibs / Cocoa Nibs - FREE POST - Premium Quality,$12.22
"Viva Naturals Organic Cacao Nibs, 2 Lb Bag (907G) - Keto Friendly and Vegan",$40.56
Raw Cacao / Cocoa Nibs 100% Raw Chocolate Arriba Nacional Bean 1 oz to 25 lb,$6.25
BULK 5KG Organic Cacao Nibs / Cocoa Nibs - FREE POST - Premium Quality,$100.54
"Cacao Nibs - Unsweetened, Kosher, Raw, Vegan, Sirtfood, Bulk - Food To Live®",$13.44
NIB New Cymbiotika SLEEP Liposomal Sleep Cacao 1.7 Fl Oz,$23.99
BULK 3KG Organic Cacao Nibs / Cocoa Nibs - FREE POST - Premium Quality,$62.84
Boto Superfood Cacao Nibs ( 300 grams),$11.99
(2) Mary Kay Signature Lip Gloss Brownie / Carre De Cacao 3105 ~ NIB ~ FREE SHIP,$17.95
"Jennies Macaroons, Organic Coconut Bites, with Cacao Nibs & Dark Chocolate,",$16.77
"Raw Organic Cacao Nibs, 32 oz (907 g)",$29.36
Raw Cacao / Cocoa Nibs 100% Raw Chocolate Bean Arriba Nacional 1 oz to 33 lb,$5.87
USDA Organic Cacao Nibs 1 oz or 100 grams Kosher Brazil Theobroma cocoa beans,$5.50
Joaquina Botanica Porcelain Cacao + Amino Acids Crema Esencial - 1.7 Oz -NIB,$38.00
,
"Cacao Nibs, Fermented, 16 oz (454 g)",$17.99
"Raw Organic Cacao Nibs, 2 Lbs (2 Pack) - Raw | Keto | Vega",$59.32
"Superfoods Roasted Organic Cacao Nibs, 1 Lb - USDA CERTIFIED | Keto | Vegan",$24.95
Endorfin Foods Dark Chocolate Bar With Pink Salt And Cacao Nibs 1.4 Oz,$5.84
Terrasoul Superfoods Raw Organic Cacao Nibs 3lbs- Raw Keto Vegan (See Photos),$44.99
"Navitas Orangics Organic Cacao Nibs, Unsweetened, 8 oz (227 g) 100% Cacao",$13.25
Pacari Chocolate Covered Cacao Nibs - 2 oz. 57 g. Visit store for other flavors!,$6.99
Woodstock Cacao Nibs - Single Bulk Item - 5Lb,$55.00
Mud Water: Rise Cacao Masala Chai 30 Serving Tin Whip & Creamer Sample NIB,$33.99
Organic Raw Cacao / Cocoa NIBS 100% Pure RAW Chocolate Superfood Premium 1/4 Lb,$12.97
"Anthony's Organic Cacao Cocoa Nibs, 2 lb, Batch Tested and Verified Gluten Free",$33.67
Judee's Organics Organic Cacao Nibs 8 oz Pkg BB 04/2024,$11.50
BECCA Ever-Matte Shine Proof Foundation 1.35 oz 40ml- SELECT SHADE NIB,$15.03
Pascha 100% Cacao Dark Chocolate Bar With Crunchy Nibs 2.82 Oz,$4.70
Raw Cacao / Cocoa Nibs 100% Pure Kosher 1 lb. Raw Chocolate Arriba Nacional Bean,$18.95
NOW FOODS Cacao Nibs Organic & Raw 8 oz,$12.91
Air Jordan 4 Retro (GS) Cacao Wow Size 7Y Style Unisex FB2214-200 Travis DS NIB,$213.75
"Cacao Sweet Nibs, Coconut Sweetened, 16 oz (454 g)",$20.11
GNM Natural Cacao Nibs Powder Raw Fresh SuperFood Deep Taste Health 250g,$26.03
Brewers Best Organic Cacao (Cocoa) Nibs-4 oz.,$9.86
1kg Cacao Nibs Powder Raw Fresh SuperFood Antioxidants + Free Track,$49.45
"Organic Raw Peruvian Cacao Nibs, Unsweetened , 1 lb (16 oz)",$14.22
Premium Pure Organic Raw Cocoa Nibs Cacao Great Best Quality Different sizes,$23.59
"Nuts.com Organic Cacao Nibs, 1 Lb & powder 2 lb total CERTIFIED | Keto | Vegan",$14.95
"Anthony's Organic Cacao Cocoa Nibs, 2 lb, Batch Tested and Verified Gluten Free",$40.68
"Organic Sweet Cacao Nibs, 8 oz (227 g)",$14.57
TPSY Brows on Fleek Dual Eyebrow Definer -Cacao Nibs,$9.99
"Viva Naturals Organic Cacao Nibs, 2 lb Bag (907g) - Keto Friendly and Vegan Unsw",$37.40
BULK 2KG Organic Cacao Nibs / Cocoa Nibs - FREE POST - Premium Quality,$47.55
"Viva Naturals Organic Cacao Nibs, 1 Lb - Certified Keto and Vegan Superfood, Per",$20.43
"Organic Sweet Cacao Nibs – Non-GMO, Kosher, Lightly Sweetened with Coconut Sugar",$10.89
Viva Naturals Organic Cacao Nibs 1 Lb - Certified Keto and Vegan Superfood Per,$27.33
ORGANIC CACAO NIBS UNSWEETENED RAW PERUVIAN KETO NON-GMO KOSHER 4oz,$12.99
Laura Mercier Mini Caviar Stick Eye Duo Dark Cacao Matte & Rosegold Shimmer NIB,$16.00
ORGANIC CACAO POWDER | CACAO NIBS | CACAO BUTTER - FREE POST,$3.60
100 gram Organic Cacao Nibs / Cocoa Nibs - FREE POST - Premium Quality,$5.43
Cacao Nibs - 100% Mexican Grown and Processed,$16.00
Cacao Nibs Naturally Sweetened w/ Yacon Syrup 8oz | Sugar Free Keto Paleo Vegan,$21.99
Jennies Coconut Bites With Cacao Nibs & Dark Chocolate USDA ORGANIC 24 oz Bag,$22.50
"Navitas Organics Organic Cacao Nibs 16 oz 454 g B Corp, BPA-Free, Fair Trade,",$20.60
Costa Esmeraldas Roasted Cacao Nibs,$15.99
"Now Foods Real Food Organic Raw Cacao Nibs 8 oz 227 g Non-GMO, Organic, Raw,",$12.92
"Organic Cacao Nibs, Unsweetened, 8 oz (227 g)",$13.43
NIB W Nike Dunk Low 'Cacao Wow' (2023) DD1503-124 Size Women’s 11 / Men’s 9.5,$124.00
"Raw Cacao Nibs, 8 oz. Bag, 76 Servings — Organic, Non-GMO, Fair Trade, Gluten...",$12.62
"Organic Cacao Nibs, 10 oz (283 g)",$16.86
Oaxacan Cacao Mexican Hot Chocolate Jug Whisk NEW Gift Set By Verve Culture NIB,$59.99
"Raw Organic Cacao Nibs, 16 oz (454 g)",$19.82
Viva Naturals Organic Cacao Nibs 2 lb Bag (907g) Keto Friendly and Vegan Unsw,$38.97
"Viva Naturals Organic Cacao Nibs, 2 lb Bag (907g) - Keto Friendly and Vegan Unsw",$27.05
NIB W Nike Dunk Low 'Cacao Wow' (2023) DD1503-124 Size Women’s 11 / Men’s 9.5-,$127.95
"Anthonys Organic Cacao Cocoa Nibs, 2 lb, Batch Tested and Verified Gluten Free",$40.27
Organic Raw Cacao Nibs 8 Oz By Now Foods,$13.83
6 nib mor Vegan Mint Organic Dark Chocolate Bar Cacao Square Snack 3.56oz Pouch,$42.01
Scentsy Warmer Halloween Haunted House Haunting Good Time New NIB,$33.96
PATRIMONIO CACAO - Chocolate Single Origin Arriba Cocoa made in ECUADOR,$7.50
"Terrasoul Superfoods Raw Organic Cacao Nibs, 2 Lbs (2 Pack) - Raw | Keto | Vegan",$41.29
BECCA ~ SKIN LOVE WEIGHTLESS BLUR FOUNDATION~ CACAO PICTURED ~SEALED NIB,$8.00
9 Dual Eybrow Definer AVON TPSY CACAO NIBS Pencil Crayons Gel NIB,$79.00
Raw Cacao Nibs 5lb | Sugar Free Keto Paleo Vegan,$51.99
Organic Raw Cacao Nibs 8 Oz By Now Foods,$13.83
"Terrasoul Superfoods Raw Organic Cacao Nibs, 1 Lb - Raw | Keto | Vegan",$26.79
"Organic Cacao/Cocoa Nibs, 2 Pounds by Anthonys, Batch Tested and Verified Gluten",$15.99
Raw Cacao / Cocoa Nibs - 100% RAW Chocolate Arriba Nacional Bean BULK WHOLESALE,$6.99
"TCHO Roasted Ecuador Cacao Nibs 7.8 oz (222g) USDA Organic, Fair Trade Certified",$13.95
